{
 "plano": "1.4.0",
 "atualizado_em": "2026-10-28T02:05:22+00:00",
 "incrementos": [
  {
   "id": "I1",
   "versao": "1.4.0a1",
   "estado": "aberto",
   "rotulo": "1.4.0a1: sem íntegras do STJ; I1.2 adiado para 1.4.0a2 (I2.6) após passe final com bloqueador",
   "itens": [
    {
     "id": "I1.1",
     "estado": "concluido",
     "nota": "Trusted Publisher; 1.3.0 publicada na PyPI pela reexecução do run 39676521181, hashes iguais ao SHA256SUMS da release"
    },
    {
     "id": "I1.2",
     "estado": "adiado",
     "nota": "PR #10: reduzido pelo D5 (docs/auditoria/1.4.0/pr10-reducao-escopo.md) e adiado após passe final com bloqueador (docs/auditoria/1.4.0/pr10-adiamento.md); não incorporado"
    },
    {
     "id": "I1.3",
     "estado": "concluido",
     "nota": "PR #9, commit 7cf2b7c"
    },
    {
     "id": "I1.4",
     "estado": "pendente",
     "nota": ""
    },
    {
     "id": "I1.5",
     "estado": "pendente",
     "nota": ""
    },
    {
     "id": "I1.6",
     "estado": "concluido",
     "nota": "PR #9, commit 7cf2b7c"
    },
    {
     "id": "S0",
     "estado": "pendente",
     "nota": ""
    }
   ],
   "etapas": {
    "1_desenvolvimento": {
     "estado": "pendente",
     "evidencias": [],
     "nota": ""
    },
    "2_teste": {
     "estado": "pendente",
     "evidencias": [],
     "nota": ""
    },
    "3_commit": {
     "estado": "pendente",
     "evidencias": [],
     "nota": ""
    },
    "4_incorporacao": {
     "estado": "pendente",
     "evidencias": [],
     "nota": ""
    },
    "5_publicacao": {
     "estado": "pendente",
     "evidencias": [],
     "nota": ""
    },
    "6_distribuicao": {
     "estado": "pendente",
     "evidencias": [],
     "nota": ""
    },
    "7_instalacao": {
     "estado": "pendente",
     "evidencias": [],
     "nota": ""
    },
    "8_execucao": {
     "estado": "pendente",
     "evidencias": [],
     "nota": ""
    }
   },
   "reducoes_de_escopo": [
    {
     "item": "I1.2",
     "data": "2026-10-28",
     "decisao": "D5: passe final independente COM BLOQUEADOR sobre o escopo reduzido; I1.2 adiado inteiro para I2.6",
     "registro": "docs/auditoria/1.4.0/pr10-adiamento.md",
     "motivo": "candidato único pelos metadados vincula outro julgamento quando a ementa é só citada; recurso omite graus intermediários"
    }
   ]
  },
  {
   "id": "I2",
   "versao": "1.4.0a2",
   "estado": "aberto",
   "rotulo": null,
   "itens": [
    {
     "id": "I2.1",
     "estado": "pendente",
     "nota": ""
    },
    {
     "id": "I2.2",
     "estado": "pendente",
     "nota": ""
    },
    {
     "id": "I2.3",
     "estado": "pendente",
     "nota": ""
    },
    {
     "id": "I2.4",
     "estado": "pendente",
     "nota": ""
    },
    {
     "id": "I2.5",
     "estado": "pendente",
     "nota": ""
    },
    {
     "id": "I2.6",
     "estado": "pendente",
     "nota": "segmentação tipada e ligação das íntegras do STJ ao acervo, vindas do I1.2 reduzido"
    }
   ],
   "etapas": {
    "1_desenvolvimento": {
     "estado": "pendente",
     "evidencias": [],
     "nota": ""
    },
    "2_teste": {
     "estado": "pendente",
     "evidencias": [],
     "nota": ""
    },
    "3_commit": {
     "estado": "pendente",
     "evidencias": [],
     "nota": ""
    },
    "4_incorporacao": {
     "estado": "pendente",
     "evidencias": [],
     "nota": ""
    },
    "5_publicacao": {
     "estado": "pendente",
     "evidencias": [],
     "nota": ""
    },
    "6_distribuicao": {
     "estado": "pendente",
     "evidencias": [],
     "nota": ""
    },
    "7_instalacao": {
     "estado": "pendente",
     "evidencias": [],
     "nota": ""
    },
    "8_execucao": {
     "estado": "pendente",
     "evidencias": [],
     "nota": ""
    }
   },
   "reducoes_de_escopo": []
  },
  {
   "id": "I3",
   "versao": "1.4.0a3",
   "estado": "aberto",
   "rotulo": null,
   "itens": [
    {
     "id": "I3.1",
     "estado": "pendente",
     "nota": ""
    },
    {
     "id": "I3.2",
     "estado": "pendente",
     "nota": ""
    },
    {
     "id": "I3.3",
     "estado": "pendente",
     "nota": ""
    },
    {
     "id": "I3.4",
     "estado": "pendente",
     "nota": ""
    },
    {
     "id": "I3.5",
     "estado": "pendente",
     "nota": ""
    },
    {
     "id": "I3.6",
     "estado": "pendente",
     "nota": ""
    },
    {
     "id": "I3.7",
     "estado": "pendente",
     "nota": ""
    },
    {
     "id": "I3.8",
     "estado": "pendente",
     "nota": ""
    }
   ],
   "etapas": {
    "1_desenvolvimento": {
     "estado": "pendente",
     "evidencias": [],
     "nota": ""
    },
    "2_teste": {
     "estado": "pendente",
     "evidencias": [],
     "nota": ""
    },
    "3_commit": {
     "estado": "pendente",
     "evidencias": [],
     "nota": ""
    },
    "4_incorporacao": {
     "estado": "pendente",
     "evidencias": [],
     "nota": ""
    },
    "5_publicacao": {
     "estado": "pendente",
     "evidencias": [],
     "nota": ""
    },
    "6_distribuicao": {
     "estado": "pendente",
     "evidencias": [],
     "nota": ""
    },
    "7_instalacao": {
     "estado": "pendente",
     "evidencias": [],
     "nota": ""
    },
    "8_execucao": {
     "estado": "pendente",
     "evidencias": [],
     "nota": ""
    }
   },
   "reducoes_de_escopo": []
  },
  {
   "id": "I4",
   "versao": "1.4.0",
   "estado": "aberto",
   "rotulo": null,
   "itens": [
    {
     "id": "I4.1",
     "estado": "pendente",
     "nota": ""
    },
    {
     "id": "I4.2",
     "estado": "pendente",
     "nota": ""
    },
    {
     "id": "I4.3",
     "estado": "pendente",
     "nota": ""
    },
    {
     "id": "I4.4",
     "estado": "pendente",
     "nota": ""
    }
   ],
   "etapas": {
    "1_desenvolvimento": {
     "estado": "pendente",
     "evidencias": [],
     "nota": ""
    },
    "2_teste": {
     "estado": "pendente",
     "evidencias": [],
     "nota": ""
    },
    "3_commit": {
     "estado": "pendente",
     "evidencias": [],
     "nota": ""
    },
    "4_incorporacao": {
     "estado": "pendente",
     "evidencias": [],
     "nota": ""
    },
    "5_publicacao": {
     "estado": "pendente",
     "evidencias": [],
     "nota": ""
    },
    "6_distribuicao": {
     "estado": "pendente",
     "evidencias": [],
     "nota": ""
    },
    "7_instalacao": {
     "estado": "pendente",
     "evidencias": [],
     "nota": ""
    },
    "8_execucao": {
     "estado": "pendente",
     "evidencias": [],
     "nota": ""
    }
   },
   "reducoes_de_escopo": []
  }
 ],
 "excecoes": [
  {
   "alvo": "TJAP",
   "tipo": "tribunal",
   "estado": "bloqueio_externo_documentado",
   "revisar_em": "2027-01-31",
   "registro": "docs/PLANO-1.4.0.md D4",
   "nota": "data fixada pelo supervisor em 28/10/2026; o D4 exige data de revisão e o plano não a fixa"
  },
  {
   "alvo": "pedidos de autos",
   "tipo": "funcao",
   "estado": "excluida_pelo_titular",
   "revisar_em": null,
   "registro": "docs/PLANO-1.4.0.md seção 9 item 4",
   "nota": ""
  }
 ]
}
